{
  "schema": "engine-sim-offline/scenario",
  "id": "bmw-m52tub28-cleanroom-inertial-dyno-700-6500rpm",
  "engine": "bmw-m52tub28-cleanroom",
  "fuel": "premium-unleaded-gasoline",
  "ambient": {
    "pressure": {"value": 101325, "unit": "Pa"},
    "temperature": {"value": 298.15, "unit": "K"},
    "relative_humidity_01": 0
  },
  "initial_thermal_state": {
    "gas_temperature": {"value": 298.15, "unit": "K"},
    "wall_temperature": {"value": 363.15, "unit": "K"},
    "coolant_temperature": {"value": 363.15, "unit": "K"},
    "oil_temperature": {"value": 363.15, "unit": "K"}
  },
  "crankcase": {
    "pressure": {"value": 101325, "unit": "Pa"},
    "temperature": {"value": 298.15, "unit": "K"}
  },
  "initial_state": {
    "engine_speed": {"value": 700, "unit": "rpm"},
    "crank_angle": {"value": 1.570796326795, "unit": "rad"},
    "ignition_enabled": true,
    "fuel_enabled": true,
    "starter_enabled": false,
    "dyno_enabled": true,
    "limiter_enabled": false
  },
  "preparation": {
    "type": "fixed_horizon",
    "preparation_duration": {"value": 6.44, "unit": "s"},
    "trailing_complete_cycle_count": 32
  },
  "mode": {
    "type": "inertial_dyno",
    "equivalent_inertia": {"value": 7.9, "unit": "kg*m2"},
    "throttle_01": {
      "interpolation": "right_continuous_hold",
      "points": [
        {"time": {"value": 0, "unit": "s"}, "value": 0.85}
      ]
    },
    "brake_curve": [
      {
        "engine_speed": {"value": 600, "unit": "rpm"},
        "resisting_torque": {"value": 40, "unit": "N*m"}
      },
      {
        "engine_speed": {"value": 7000, "unit": "rpm"},
        "resisting_torque": {"value": 40, "unit": "N*m"}
      }
    ],
    "target_engine_speed": {"value": 6500, "unit": "rpm"}
  },
  "events": [
    {
      "id": "inertial-dyno-running",
      "time": {"value": 0, "unit": "s"},
      "payload": {
        "type": "operating_state_patch",
        "dyno_enabled": true
      }
    }
  ],
  "rates": {
    "physics": {"numerator": "20000", "denominator": "1", "unit": "Hz"},
    "capture": {"numerator": "20000", "denominator": "1", "unit": "Hz"},
    "source_processing": {"numerator": "192000", "denominator": "1", "unit": "Hz"},
    "acoustics": {"numerator": "192000", "denominator": "1", "unit": "Hz"},
    "delivery": {"numerator": "192000", "denominator": "1", "unit": "Hz"}
  },
  "quality": {
    "id": "listening",
    "process_block_capacity_frames": 3840,
    "event_queue_capacity": 3800,
    "telemetry_capacity_frames": 1
  },
  "total_duration": {"value": 21.44, "unit": "s"},
  "audible_start": {"value": 6.44, "unit": "s"},
  "audible_duration": {"value": 15, "unit": "s"},
  "public_seed": "12648430",
  "output": {
    "buses": ["master-engine-raw", "master-engine-audition"],
    "telemetry_channels": []
  }
}
