{
  "schema": "engine-sim-offline/scenario",
  "id": "radial-5-cleanroom-prescribed-1500rpm",
  "engine": "radial-5-cleanroom",
  "fuel": "gasoline-default",
  "ambient": {
    "pressure": {"value": 101325, "unit": "Pa"},
    "temperature": {"value": 298.15, "unit": "K"},
    "relative_humidity_01": 0
  },
  "initial_thermal_state": {
    "gas_temperature": {"value": 298.15, "unit": "K"},
    "wall_temperature": {"value": 363.15, "unit": "K"},
    "coolant_temperature": {"value": 363.15, "unit": "K"},
    "oil_temperature": {"value": 363.15, "unit": "K"}
  },
  "crankcase": {
    "pressure": {"value": 101325, "unit": "Pa"},
    "temperature": {"value": 298.15, "unit": "K"}
  },
  "initial_state": {
    "engine_speed": {"value": 1500, "unit": "rpm"},
    "crank_angle": {"value": 1.17809724509625, "unit": "rad"},
    "ignition_enabled": true,
    "fuel_enabled": true,
    "starter_enabled": false,
    "dyno_enabled": true,
    "limiter_enabled": false
  },
  "preparation": {
    "type": "fixed_settling",
    "warm_up_duration": {"value": 0, "unit": "s"},
    "settling_duration": {"value": 0, "unit": "s"}
  },
  "mode": {
    "type": "external_speed",
    "engine_speed": {
      "value_dimension": "angular_speed",
      "interpolation": "right_continuous_hold",
      "points": [
        {"time": {"value": 0, "unit": "s"}, "value": {"value": 1500, "unit": "rpm"}}
      ]
    },
    "throttle_01": {
      "interpolation": "right_continuous_hold",
      "points": [
        {"time": {"value": 0, "unit": "s"}, "value": 0.25}
      ]
    }
  },
  "events": [],
  "rates": {
    "physics": {"numerator": "10000", "denominator": "1", "unit": "Hz"},
    "capture": {"numerator": "10000", "denominator": "1", "unit": "Hz"},
    "source_processing": {"numerator": "192000", "denominator": "1", "unit": "Hz"},
    "acoustics": {"numerator": "192000", "denominator": "1", "unit": "Hz"},
    "delivery": {"numerator": "192000", "denominator": "1", "unit": "Hz"}
  },
  "quality": {
    "id": "topology-regression",
    "process_block_capacity_frames": 3840,
    "event_queue_capacity": 64,
    "telemetry_capacity_frames": 1
  },
  "total_duration": {"value": 0.08, "unit": "s"},
  "audible_start": {"value": 0, "unit": "s"},
  "audible_duration": {"value": 0.08, "unit": "s"},
  "public_seed": "12648430",
  "output": {
    "buses": ["master-engine-raw", "master-engine-audition"],
    "telemetry_channels": []
  }
}
